# 6, 2, #e4b015, Bands, ---, ---, ---, ---, ---, ---, ---, Individual tectonic bands, Characterize surface and subsurface properties and investigate formation and deformation style of individual bright bands,,,,,,,,,,
6, 2, 1, Hursag Sulcus, -15.0, 98.0, 600, -21, -5, 89, 106, Poorly resolved small polygon of dark terrain (part of Melotte Regio) surrounded and cut by several bright bands (Shuruppak and Hursag Sulcus). Additional features: impact crater morphologies in dark and bright terrain; superimposed bright secondary craters originating from Punt (#5.0.3), Study deformation style and formation of individual bright bands and contact to dark terrain with respect to surface and subsurface properties; studysurface degradation within dark and bright terrain; degraded impact morphologies, 1, 1, 1, 1, 1, 1, 1, 1, 0, 0
6, 2, 2, Anshar Sulcus, 25.0, 153.0, 300, 20, 31, 147, 157, Piece of dark terrain (Marius Regio) cut and surrounded by several bright bands (Mashu and Anshar Sulcus); numerous small-scale polygons of dark terrain in the northwest of the location, Study deformation style and formation of individual bright bands and contact to dark terrain with respect to surface and subsurface properties, 1, 1, 1, 1, 1, 1, 1, 1, 0, 0
6, 2, 3, Kishar Sulcus, -17.0, 148.0, 300, -18, -6, 130, 145, Broad band of comparably smooth bright terrain cut by Lakhamu Fossa N of Melotte Regio; superimposed linear chains of potential secondary craters from (a) so far unknown primary crater(s), Study deformation style and formation of individual bright bands and contact to dark terrain with respect to surface and subsurface properties, 1, 1, 1, 1, 1, 1, 1, 1, 0, 0
6, 2, 4, Dardanus Sulcus, -31.5, 347, 600, -23, -15, 340, 352, Bright band intersecting Nicholson Regio; example of right-lateral strike-slip tectonism. Additional features: dark terrain; degraded impact craters ofdifferent morphologies, Study deformation style and formation of individual bright bands and contact to dark terrain with respect to surface and subsurface properties; study strike-slip tectonism in detail; study surface degradation within dark terrain, 1, 1, 1, 1, 1, 1, 1, 1, 0, 0
6, 2, 5, Arbela Sulcus, -17, 12.5, 400, -19, -14, 10, 15, Bright band intersecting Nicholson Regio; partly intersecting impact craters. Additional features: dark terrain; degraded impact craters of different ages; sizes and morphologies, Study deformation style and formation of individual bright bands and contact to dark terrain with respect to surface and subsurface properties; study impact crater deformation; study surface degradation within dark terrain, 1, 1, 1, 1, 1, 1, 1, 1, 0, 0
6, 2, 6, Elam/Nippur Sulcus, 48.6, 171.9, 560, 43, 55, 165, 177, Bright bands of Elam and Nippur Sulcus intersecting slivers of dark terrain including very smooth portions of bright terrain; contact to dark terrain. Additional features: smallfresh impact craters, Study deformation style and formation of individual bright bands and contact to dark terrain with respect to surface and subsurface properties; studyfresh impactcraters, 1, 1, 1, 1, 1, 1, 1, 1, 0, 0
6, 2, 7, Ur/Philae Sulcus, 58.7, 188.8, 43, 55, 62, 184, 191, Bright bands of Ur and Philae Sulcus between and surrounding dark terrain. Additional features: degraded impact crater Lapton located in dark terrain, Study deformation style and formation of individual bright bands and contact to dark terrain with respect to surface and subsurface properties, 1, 1, 1, 1, 1, 1, 1, 1, 0, 0
# 6, 3, #e4b015, Network of Bands, ---, ---, ---, ---, ---, ---, ---,  Complex network of tectonic features, Investigate formation and deformation style of resurfacing with respect to surface and subsurface properties,,,,,,,,,,
6, 3, 1, Babylon Sulci I, -38.0, 227.0, 450, -43, -32, 222, 233, Portion of extensively resurfaced area of Babylon Sulci (different deformation styles) including potential smooth bright terrain. Additional features: small fresh central peak and pedestal craters, Characterize deformation style of individual polygons or cells of bright terrain with respect to surface and subsurface properties; study age relationships of different resurfacing styles; search for Europa-like resurfacing; search for signs of surface-ocean interaction, 1, 1, 1, 1, 1, 1, 1, 1, 0, 0
6, 3, 2, Uruk Sulcus I, -6.0, 210.0, 500, -11, 1, 202, 218, Portion of Uruk Sulcus consisting of a network of differently deformed cells/polygons of bright terrain in contact to the dark terrain of Galileo and Marius Regio; possible over flown portions of dark terrain. Additional features: smallfresh bright (one dark) impact craters; additional more or less degraded impact craters in dark and bright terrain of different morphologies, Study deformation style and formation of individual polygons or cells of bright terrain with respect to surface and subsurface properties; define possible age relationships to reconstruct the formation of Uruk Sulcus; characterize contact to dark terrain; investigate un-weathered material of fresh impact craters, 1, 1, 1, 1, 1, 1, 1, 1, 0, 0
6, 3, 3, Uruk Sulcus II, 9.0, 180.0, 500, 5, 15, 182, 192, Portion of Uruk Sulcus consisting of a network of differently deformed cells/polygons (possibly including very smooth portions) of bright terrain in contact to the dark terrain of Marius Regio. Additional features: smallfresh impact craters; additional more or less degraded impact craters in dark and bright terrain of different morphologies networks of bands in Uruk Sulcuswithdifferent stylesof contact to dark terrain., Study deformation style and formation of individual polygons or cells of bright terrain with respect to surface and subsurface properties; define possible age relationships to reconstruct the formation of Uruk Sulcus; characterize contact to dark terrain; investigate un-weathered material of fresh impact craters formation of Uruk Sulcus., 1, 1, 1, 1, 1, 1, 1, 1, 0, 0
6, 3, 4, Mysia Sulci, -1.0, 318.0, 500, -6, 4, 41, 51, Extensively resurfaced portion of bright terrain region South of Mysia Sulci. Additional features: superimposed small fresh impact craters of different morphologies (at least one pedestal crater), Study deformation style and formation of individual polygons or cells of bright terrain with respect to surface and subsurface properties; define possible age relationships of deformation styles; investigate un-weathered material of fresh impact craters; search for signs of surface-ocean interaction, 1, 1, 1, 1, 1, 1, 1, 1, 0, 0
6, 3, 5, Phrygia Sulcus I, 15, 347, 350, 10, 20, 345, 355, Extensively resurfaced region of PhrygiaSulcus east of Tros extensively resurfaced region of Phrygia Sulcus east of Tros, Characterize deformation style of individual polygons or cells of bright terrain with respect to surface and subsurface properties; study age relationships of different resurfacing styles; search for signs of surface-ocean interaction, 1, 1, 1, 1, 1, 1, 1, 1, 0, 0
6, 3, 6, Babylon Sulci II, 4.0, 285.0, 550, -1, 10, 280, 291, Slivers of a heavily resurfaced polygon of dark terrain surrounded and intersected by extensively resurfaced (partly very smooth) Babylon Sulci. Additional features: Fresh and partially degraded impact craters of different morphologies, Characterize resurfacing of dark terrain; Study deformation style of individual polygons or cells of bright terrain with respect to surface and subsurface properties; study age relationships of different resurfacing styles, 1, 1, 1, 1, 1, 1, 1, 1, 0, 0
6, 3, 7, Babylon Sulci III, -25.0, 308.0, 500, -31, -22, 302, 311, Extensively resurface portionof bright terrain of Babylon Sulci withdifferent deformations styles including a very smooth portion of bright terrain. Additional features: sliver of dark terrain; superimposed impact craters, Study deformation style and formation of individual polygons or cells of bright terrain with respect to surface and subsurface properties; define possible age relationships of deformation styles; investigate impact crater morphologies; search for signs of surface-ocean interaction, 1, 1, 1, 1, 1, 1, 1, 1, 0, 0
6, 3, 8, Babylon sulci III, -8.5, 296.0, 400, -13, -4, 290, 300, Extensively resurface portionof bright terrain of Babylon Sulci withdifferent deformations styles. Additional features: fresh dark floor and bright impact craters; additional more or less degraded impact craters of different morphologies, Study deformation style and formation of individual polygons or cells of bright terrain with respect to surface and subsurface properties; define possible age relationships of deformation styles; investigate nature and origin of dark floor craters and degradation of impact crater morphologies in the bright terrain, 1, 1, 1, 1, 1, 1, 1, 1, 0, 0
6, 3, 9 , Babylon Sulci V, -7.9, 282.3, 60, -11, -5, 276, 282, Extensively resurface portionof bright terrain of Babylon Sulci withdifferent deformations styles. Additional features: fresh bright impact craters; additional more or less degraded impact craters ofdifferent morphologies, Study deformation style and formation of individual polygons or cells of bright terrain with respect to surface and subsurface properties; define possible age relationships of deformation styles; search for signs of surface-ocean interaction; investigate degradation of impact crater morphologies in the bright terrain, 1, 1, 1, 1, 1, 1, 1, 1, 0, 0
6, 3, 10, Sippar Sulcus, -34, 175, 200, -26, -17, 171, 182, Reticulate terrain within the extensively resurfaced bright terrain of Sippar Sulcus, Study deformation style and formation of individual polygons or cells of bright terrain with respect to surface and subsurface properties; define possible age relationships of deformation styles; investigate the formation process; age of reticulate terrain and association with bright terrain formation, 1, 1, 1, 1, 1, 1, 1, 1, 0, 0
6, 3, 11, Phrygia Sulcus II, 6.5, 314.5, 600, 2.0, 15.0, 310.0, 320.0, Extensively resurfaced portion of Phrygia Sulcus west of Tros with relicts of potential Europa-like deformation style such as double ridges, Study deformation style and formation of individual polygons or cells of bright terrain with respect to surface and subsurface properties; define possible age relationships of deformation styles; investigate impact crater morphologies; search for Europa-like resurfacing and signs of surface-ocean interaction, 1, 1, 1, 1, 1, 1, 1, 1, 0, 0
6, 3, 12, None, -22, 194, 200, -27, -14, 188, 200, Reticulate terrain within the extensively resurfaced bright terrain of Sippar Sulcus, Study deformation style and formation of individual polygons or cells of bright terrain with respect to surface and subsurface properties; define possible age relationships of deformation styles; investigate the formation process; age of reticulate terrain and association with bright terrain formation, 1, 1, 1, 1, 1, 1, 1, 1, 0, 0
# 7, 0, #a55702, Ancient Dark Terrain, ---, ---, ---, ---, ---, ---, ---, Ancient terrain; erosional surface features in the ancient dark terrain. degraded impact craters, Determine global composition; distribution and evolution of surface materials; characterize surface degradation in relation with external environment and subsurface properties (GB/GC/GD/GE),,,,,,,,,,
7, 0, 1, None, -27.3, 221.9, 400, -30, -23, 215, 224, Portion of dark terrain in Marius Regio with smooth areas covered by dark material and remnants of a degraded dome crater. Additional features: grooves and narrow bands of bright terrain; additional degraded impact craters, Study nature and origin of dark material and processes responsible for surface degradation; search for possible organic compounds; study formation of narrow bright bands and their influence onto the evolution of the dark terrain, 1, 1, 1, 1, 0, 0, 1, 1, 0, 0
7, 0, 2, Perrine Regio I, 24.5, 346, 400, 21, 31, 340, 348, Poorly resolved portion of dark terrain in Perrine Regio including numerous more or less degraded impact craters. Additional features: ejecta of Tros, Study nature and origin of dark material; search for possible organic compounds; investigate processes responsible for surface degradation, 1, 1, 1, 1, 0, 0, 1, 1, 0, 0
7, 0, 3, Perrine Regio II, 44, 347, 350, 42, 48, 346, 358, Poorly resolved but presumably darkest region in Perrine Regio, Study nature and origin of dark material; search for possible organic compounds; investigate processes responsible for surface degradation, 1, 1, 1, 1, 0, 0, 1, 1, 0, 0
7, 0, 4, Marius Regio I, 3.5, 187, 350, -7, 0, 182, 191, Comparably pristine and uniform region of dark terrain unaffected by tectonic deformations within Marius Regio with numerous more or less degraded impact features, Study nature and origin of dark material and processes responsible for surface degradation; study formation of adjacent narrow bright bands and their influence onto the evolution of the dark terrain, 1, 1, 1, 1, 0, 0, 1, 1, 0, 0
7, 0, 5, Nicholson Regio I, -16, 29, 400, -22, -15, 24, 35, Mostly uniform portion of dark terrain within Nicholson Regio with sets of degraded arcuate furrows and numerous more or less degraded impact craters., Study nature and origin of dark material and processes responsible for surface degradation; study furrow formation, 1, 1, 1, 1, 0, 0, 1, 1, 0, 0
7, 0, 6, Melotte Regio, 12.5, 94, 350, 5, 14, 92, 102, Poorly resolved portion of dark terrain in Melotte Regio in the equatorial region of the trailing hemisphere, Key region for the investigation of dark material; study nature and origin of dark material and processes responsible for surface degradation; search for possible organic compounds; studyfurrow formation, 1, 1, 1, 1, 0, 0, 1, 1, 0, 0
7, 0, 7, Galileo Regio, 37.5, 192, 600, 30, 45, 185, 200, Portion of dark terrain in Galileo Regio with arcuate impact-induced furrows (Lakhmu Fossae) and palimpsests (e.g. T ettu Facula) indifferent statesof degradation, Study nature and origin of dark material and processes responsible for surface degradation; study furrow formation, 1, 1, 1, 1, 0, 0, 1, 1, 0, 0
7, 0, 8, Nicholson Regio II, -40, 317, 450, -45, -35, 310, 325, Portion of dark terrain in western Nicholson Regio with sets of arcuate furrows, Study nature and origin of dark material and processes responsible for surface degradation; study furrow formation, 1, 1, 1, 1, 0, 0, 1, 1, 0, 0
7, 0, 9, Marius Regio II, 4, 166, 400, -1, 9, 161, 172, Comparably pristine portion of dark terrain in Marius Regio without prominent tectonic features but with numerous more or less degraded impact features, Key region for the investigation of dark material; study nature and origin of dark material and processes responsible for surface degradation; search for possible organic compounds, 0, 0, 0, 0, 0, 0, 0, 0, 0, 0
